{
  "schemaVersion": "2",
  "prd": null,
  "overview": {
    "summary": "Export a ledger as a CSV report, then an optional per-label summary."
  },
  "sharedDecisions": [],
  "bindingConstraints": [],
  "stories": [
    {
      "id": "S01",
      "name": "Export CSV",
      "dependsOn": [],
      "status": "done",
      "fis": "s01-export-csv.md",
      "completedTaskIds": [
        "TI01",
        "TI02"
      ],
      "verified": {
        "at": "2026-04-16T10:24Z",
        "summary": "Ran 15 tests in 0.004s OK"
      },
      "scope": "Render records as CSV and write the report file.",
      "sourceRefs": [],
      "provenance": null,
      "assetRefs": [],
      "sequencing": null
    },
    {
      "id": "S02",
      "name": "Summary Flag",
      "dependsOn": [
        "S01"
      ],
      "status": "pending",
      "fis": "s02-summary-flag.md",
      "completedTaskIds": [],
      "scope": "Append per-label totals to the report behind a command-line flag.",
      "sourceRefs": [],
      "provenance": null,
      "assetRefs": [],
      "sequencing": "After S01 writes the report."
    }
  ]
}
